1	16715d38-ea45-4b79-82cf-a55db97b3d69	https://images.pexels.com/photos/2072453/pexels-photo-2072453.jpeg?auto=compress&cs=tinysrgb&w=800,https://images.pexels.com/photos/157842/bezel-hairstyle-man-mode-157842.jpeg?auto=compress&cs=tinysrgb&w=800,https://images.pexels.com/photos/1043471/pexels-photo-1043471.jpeg?auto=compress&cs=tinysrgb&w=800,https://images.pexels.com/photos/6310924/pexels-photo-6310924.jpeg?auto=compress&cs=tinysrgb&w=800	Short Sleeve Tops Fashion Everyday T Shirt	clothing	15.99	18	Men's Street T-shirt Summer Men's 3D Stripe Printing Short Sleeve Tops Fashion Everyday T Shirt Oversized Tee Shirt Men Clothing	2023-03-03
4	70ecb47c-2a31-4d35-bf09-d78482294321	https://images.pexels.com/photos/1670723/pexels-photo-1670723.jpeg?auto=compress&cs=tinysrgb&w=800,https://images.pexels.com/photos/1302307/pexels-photo-1302307.jpeg?auto=compress&cs=tinysrgb&w=800,https://images.pexels.com/photos/10976653/pexels-photo-10976653.jpeg?auto=compress&cs=tinysrgb&w=800,https://images.pexels.com/photos/17834/pexels-photo.jpg?auto=compress&cs=tinysrgb&w=800	New Cool Stainless Steel Rotatable Couple Ring	jewelries	125	20	New Cool Stainless Steel Rotatable Couple Ring High Quality Spinner Chain Rotable Rings for Women Man Punk Jewelry Party Gift New Cool Stainless Steel Rotatable Couple Ring High Quality Spinner Chain Rotable Rings for Women Man Punk Jewelry Party Gift New Cool Stainless Steel Rotatable Couple Ring High Quality Spinner Chain Rotable Rings for Women Man Punk Jewelry Party Gift New Cool Stainless Steel Rotatable Couple Ring High Quality Spinner Chain Rotable Rings for Women Man Punk Jewelry Party Gift New Cool Stainless Steel Rotatable Couple Ring High Quality Spinner Chain Rotable Rings for Women Man Punk Jewelry Party Gift	2023-03-03
3	2ff524cb-b71a-490f-9241-d6d7e337c54c	https://images.pexels.com/photos/947885/pexels-photo-947885.jpeg?auto=compress&cs=tinysrgb&w=800,https://images.pexels.com/photos/343720/pexels-photo-343720.jpeg?auto=compress&cs=tinysrgb&w=800,https://images.pexels.com/photos/46710/pexels-photo-46710.jpeg?auto=compress&cs=tinysrgb&w=800,https://images.pexels.com/photos/701877/pexels-photo-701877.jpeg?auto=compress&cs=tinysrgb&w=800	Luxury Square Vintage Polarized Sunglasses For Men	accessories	18	20	Luxury Square Vintage Polarized Sunglasses For Men Women Fashion Travel Driving Anti-glare Sun Glasses Male TR90 Eyewear UV400 Luxury Square Vintage Polarized Sunglasses For Men Women Fashion Travel Driving Anti-glare Sun Glasses Male TR90 Eyewear UV400 Luxury Square Vintage Polarized Sunglasses For Men Women Fashion Travel Driving Anti-glare Sun Glasses Male TR90 Eyewear UV400 Luxury Square Vintage Polarized Sunglasses For Men Women Fashion Travel Driving Anti-glare Sun Glasses Male TR90 Eyewear UV400 Luxury Square Vintage Polarized Sunglasses For Men Women Fashion Travel Driving Anti-glare Sun Glasses Male TR90 Eyewear UV400	2023-03-03
7	0e7c9356-6a7f-4fea-8385-4830733d0766	https://images.pexels.com/photos/2529148/pexels-photo-2529148.jpeg?auto=compress&cs=tinysrgb&w=800,https://images.pexels.com/photos/1598505/pexels-photo-1598505.jpeg?auto=compress&cs=tinysrgb&w=800,https://images.pexels.com/photos/1032110/pexels-photo-1032110.jpeg?auto=compress&cs=tinysrgb&w=800,https://images.pexels.com/photos/1280064/pexels-photo-1280064.jpeg?auto=compress&cs=tinysrgb&w=800	Breathable Mesh Fashion Tennis sneakers for Men	shoes	345	19	2023 Men's Casual Shoes Light Color Sports Large Outdoor Breathable Mesh Fashion Tennis for Men sneakers men 2023 Men's Casual Shoes Light Color Sports Large Outdoor Breathable Mesh Fashion Tennis for Men sneakers men 2023 Men's Casual Shoes Light Color Sports Large Outdoor Breathable Mesh Fashion Tennis for Men sneakers men 2023 Men's Casual Shoes Light Color Sports Large Outdoor Breathable Mesh Fashion Tennis for Men sneakers men 2023 Men's Casual Shoes Light Color Sports Large Outdoor Breathable Mesh Fashion Tennis for Men sneakers men	2023-03-03
6	8afba3f1-be51-44c5-a877-0ca4778a46a5	https://images.pexels.com/photos/125779/pexels-photo-125779.jpeg?auto=compress&cs=tinysrgb&w=800,https://images.pexels.com/photos/190819/pexels-photo-190819.jpeg?auto=compress&cs=tinysrgb&w=800,https://images.pexels.com/photos/2113994/pexels-photo-2113994.jpeg?auto=compress&cs=tinysrgb&w=800,https://images.pexels.com/photos/236915/pexels-photo-236915.jpeg?auto=compress&cs=tinysrgb&w=800	Waterproof Luminous Date Week Sport Wrist Watches	accessories	260	20	POEDAGAR Men Watch Stainless Steel Top Quailty Luxury Push Button Hidden Clasp Waterproof Luminous Date Week Sport Wrist Watches POEDAGAR Men Watch Stainless Steel Top Quailty Luxury Push Button Hidden Clasp Waterproof Luminous Date Week Sport Wrist Watches POEDAGAR Men Watch Stainless Steel Top Quailty Luxury Push Button Hidden Clasp Waterproof Luminous Date Week Sport Wrist Watches POEDAGAR Men Watch Stainless Steel Top Quailty Luxury Push Button Hidden Clasp Waterproof Luminous Date Week Sport Wrist Watches POEDAGAR Men Watch Stainless Steel Top Quailty Luxury Push Button Hidden Clasp Waterproof Luminous Date Week Sport Wrist Watches	2023-03-03
5	ecbab5c1-2878-4cd3-9084-3848499f650b	https://images.pexels.com/photos/9332184/pexels-photo-9332184.jpeg?auto=compress&cs=tinysrgb&w=800,https://images.pexels.com/photos/7407597/pexels-photo-7407597.png?auto=compress&cs=tinysrgb&w=800,https://images.pexels.com/photos/13325931/pexels-photo-13325931.jpeg?auto=compress&cs=tinysrgb&w=800,https://images.pexels.com/photos/7134458/pexels-photo-7134458.jpeg?auto=compress&cs=tinysrgb&w=800	Gold Titanium steel Neck Chain Jewelry Gift for your woman	jewelries	108	20	Artificial gems not fade color heart Pendant Necklaces for women Gold Titanium steel Neck Chain Jewelry Gift for Girl Artificial gems not fade color heart Pendant Necklaces for women Gold Titanium steel Neck Chain Jewelry Gift for Girl Artificial gems not fade color heart Pendant Necklaces for women Gold Titanium steel Neck Chain Jewelry Gift for Girl Artificial gems not fade color heart Pendant Necklaces for women Gold Titanium steel Neck Chain Jewelry Gift for Girl Artificial gems not fade color heart Pendant Necklaces for women Gold Titanium steel Neck Chain Jewelry Gift for Girl	2023-03-03
11	21ca747f-d417-480f-9f6b-7abbb5ab281c	https://images.pexels.com/photos/343720/pexels-photo-343720.jpeg?auto=compress&cs=tinysrgb&w=800,https://images.pexels.com/photos/46710/pexels-photo-46710.jpeg?auto=compress&cs=tinysrgb&w=800,https://images.pexels.com/photos/701877/pexels-photo-701877.jpeg?auto=compress&cs=tinysrgb&w=800,https://images.pexels.com/photos/249210/pexels-photo-249210.jpeg?auto=compress&cs=tinysrgb&w=800	CLLOIO New Fashion Aluminum Photochromic Sunglasses	accessories	263	20	CLLOIO New Fashion Aluminum Photochromic Sunglasses Men Women Polarized Sun Glasses Chameleon Anti-glare Driving Oculos de sol CLLOIO New Fashion Aluminum Photochromic Sunglasses Men Women Polarized Sun Glasses Chameleon Anti-glare Driving Oculos de sol CLLOIO New Fashion Aluminum Photochromic Sunglasses Men Women Polarized Sun Glasses Chameleon Anti-glare Driving Oculos de sol CLLOIO New Fashion Aluminum Photochromic Sunglasses Men Women Polarized Sun Glasses Chameleon Anti-glare Driving Oculos de sol CLLOIO New Fashion Aluminum Photochromic Sunglasses Men Women Polarized Sun Glasses Chameleon Anti-glare Driving Oculos de sol\n	2023-03-03
10	42fa9d52-6cc6-4e02-b08e-fb930a825f80	https://images.pexels.com/photos/1750045/pexels-photo-1750045.jpeg?auto=compress&cs=tinysrgb&w=800,https://images.pexels.com/photos/1598508/pexels-photo-1598508.jpeg?auto=compress&cs=tinysrgb&w=800,https://images.pexels.com/photos/2759779/pexels-photo-2759779.jpeg?auto=compress&cs=tinysrgb&w=800,https://images.pexels.com/photos/1456706/pexels-photo-1456706.jpeg?auto=compress&cs=tinysrgb&w=800	Women Shoes Breathable Shoe For Women Zapato	shoes	390	20	Women's Sneakers Fashion Shoes Woman Platform Women's Vulcanized Shoes Sneakers Women Shoes Breathable Shoe For Women Zapato Women's Sneakers Fashion Shoes Woman Platform Women's Vulcanized Shoes Sneakers Women Shoes Breathable Shoe For Women Zapato Women's Sneakers Fashion Shoes Woman Platform Women's Vulcanized Shoes Sneakers Women Shoes Breathable Shoe For Women Zapato Women's Sneakers Fashion Shoes Woman Platform Women's Vulcanized Shoes Sneakers Women Shoes Breathable Shoe For Women Zapato Women's Sneakers Fashion Shoes Woman Platform Women's Vulcanized Shoes Sneakers Women Shoes Breathable Shoe For Women Zapato	2023-03-03
14	68b4f173-56bd-4759-a395-087f146f2d6e	https://images.pexels.com/photos/1598505/pexels-photo-1598505.jpeg?auto=compress&cs=tinysrgb&w=800,https://images.pexels.com/photos/1032110/pexels-photo-1032110.jpeg?auto=compress&cs=tinysrgb&w=800,https://images.pexels.com/photos/1280064/pexels-photo-1280064.jpeg?auto=compress&cs=tinysrgb&w=800,https://images.pexels.com/photos/1478442/pexels-photo-1478442.jpeg?auto=compress&cs=tinysrgb&w=800	Breathable Mesh Tennis Sneakers Student Comfortable Running	shoes	329.59	20	Men Shoes 2023 Trend Platform Sport Dad Fashion Casual Breathable Mesh Tennis Sneakers Student Comfortable Running Men Shoes 2023 Trend Platform Sport Dad Fashion Casual Breathable Mesh Tennis Sneakers Student Comfortable Running Men Shoes 2023 Trend Platform Sport Dad Fashion Casual Breathable Mesh Tennis Sneakers Student Comfortable Running Men Shoes 2023 Trend Platform Sport Dad Fashion Casual Breathable Mesh Tennis Sneakers Student Comfortable Running Men Shoes 2023 Trend Platform Sport Dad Fashion Casual Breathable Mesh Tennis Sneakers Student Comfortable Running	2023-03-03
19	bfa0e3c3-69c2-4a33-bf0f-5e26e338d219	https://images.pexels.com/photos/46710/pexels-photo-46710.jpeg?auto=compress&cs=tinysrgb&w=800,https://images.pexels.com/photos/701877/pexels-photo-701877.jpeg?auto=compress&cs=tinysrgb&w=800,https://images.pexels.com/photos/947885/pexels-photo-947885.jpeg?auto=compress&cs=tinysrgb&w=800,https://images.pexels.com/photos/343720/pexels-photo-343720.jpeg?auto=compress&cs=tinysrgb&w=800	Eyeglasses Classic Driving Brand Design Anti Glare Sun Glasses BS8083	accessories	115	20	Black Polarized Sunglasses For Men Aluminum Magnesium HD Eyeglasses Classic Driving Brand Design Anti Glare Sun Glasses BS8083 Black Polarized Sunglasses For Men Aluminum Magnesium HD Eyeglasses Classic Driving Brand Design Anti Glare Sun Glasses BS8083 Black Polarized Sunglasses For Men Aluminum Magnesium HD Eyeglasses Classic Driving Brand Design Anti Glare Sun Glasses BS8083 Black Polarized Sunglasses For Men Aluminum Magnesium HD Eyeglasses Classic Driving Brand Design Anti Glare Sun Glasses BS8083 Black Polarized Sunglasses For Men Aluminum Magnesium HD Eyeglasses Classic Driving Brand Design Anti Glare Sun Glasses BS8083	2023-03-03
16	88f21ed5-4beb-4e47-b085-115d57274be6	https://images.pexels.com/photos/7407597/pexels-photo-7407597.png?auto=compress&cs=tinysrgb&w=800,https://images.pexels.com/photos/13325931/pexels-photo-13325931.jpeg?auto=compress&cs=tinysrgb&w=800,https://images.pexels.com/photos/7134458/pexels-photo-7134458.jpeg?auto=compress&cs=tinysrgb&w=800,https://images.pexels.com/photos/11203732/pexels-photo-11203732.jpeg?auto=compress&cs=tinysrgb&w=800	Ring For Women Oyster Bead Butterfly Flower Open Ring Women's Jewelry	jewelries	628	20	HOYON Yellow Gold New Simulation Natural Freshwater Pearl Ring For Women Oyster Bead Butterfly Flower Open Ring Women's Jewelry HOYON Yellow Gold New Simulation Natural Freshwater Pearl Ring For Women Oyster Bead Butterfly Flower Open Ring Women's Jewelry HOYON Yellow Gold New Simulation Natural Freshwater Pearl Ring For Women Oyster Bead Butterfly Flower Open Ring Women's Jewelry HOYON Yellow Gold New Simulation Natural Freshwater Pearl Ring For Women Oyster Bead Butterfly Flower Open Ring Women's Jewelry HOYON Yellow Gold New Simulation Natural Freshwater Pearl Ring For Women Oyster Bead Butterfly Flower Open Ring Women's Jewelry	2023-03-03
20	a755aaba-d666-497f-992c-f1dd86d1496d	https://images.pexels.com/photos/10976653/pexels-photo-10976653.jpeg?auto=compress&cs=tinysrgb&w=800,https://images.pexels.com/photos/17834/pexels-photo.jpg?auto=compress&cs=tinysrgb&w=800,https://images.pexels.com/photos/1670723/pexels-photo-1670723.jpeg?auto=compress&cs=tinysrgb&w=800,https://images.pexels.com/photos/1302307/pexels-photo-1302307.jpeg?auto=compress&cs=tinysrgb&w=800	Luxury Simple Big Small Hollow Double Heart-shaped Necklace 	jewelries	28	20	2023 Luxury Simple Big Small Hollow Double Heart-shaped Necklace Exquisite Crystal Zircon Pendant Chain Women's Wedding Jewelry 2023 Luxury Simple Big Small Hollow Double Heart-shaped Necklace Exquisite Crystal Zircon Pendant Chain Women's Wedding Jewelry 2023 Luxury Simple Big Small Hollow Double Heart-shaped Necklace Exquisite Crystal Zircon Pendant Chain Women's Wedding Jewelry 2023 Luxury Simple Big Small Hollow Double Heart-shaped Necklace Exquisite Crystal Zircon Pendant Chain Women's Wedding Jewelry 2023 Luxury Simple Big Small Hollow Double Heart-shaped Necklace Exquisite Crystal Zircon Pendant Chain Women's Wedding Jewelry	2023-03-03
23	f5bd67db-6772-4354-ab08-409730671f73	https://images.pexels.com/photos/1032110/pexels-photo-1032110.jpeg?auto=compress&cs=tinysrgb&w=800,https://images.pexels.com/photos/1280064/pexels-photo-1280064.jpeg?auto=compress&cs=tinysrgb&w=800,https://images.pexels.com/photos/2529148/pexels-photo-2529148.jpeg?auto=compress&cs=tinysrgb&w=800,https://images.pexels.com/photos/1598505/pexels-photo-1598505.jpeg?auto=compress&cs=tinysrgb&w=800	Mens casual Shoes Trainer Race off white Shoes fashion	shoes	849.99	20	men shoes Sneakers Male tenis Luxury shoes Mens casual Shoes Trainer Race off white Shoes fashion loafers running Shoes for men men shoes Sneakers Male tenis Luxury shoes Mens casual Shoes Trainer Race off white Shoes fashion loafers running Shoes for men men shoes Sneakers Male tenis Luxury shoes Mens casual Shoes Trainer Race off white Shoes fashion loafers running Shoes for men men shoes Sneakers Male tenis Luxury shoes Mens casual Shoes Trainer Race off white Shoes fashion loafers running Shoes for men men shoes Sneakers Male tenis Luxury shoes Mens casual Shoes Trainer Race off white Shoes fashion loafers running Shoes for men	2023-03-03
22	3514fe31-b01e-4751-a340-d072efdc9a0f	https://images.pexels.com/photos/2113994/pexels-photo-2113994.jpeg?auto=compress&cs=tinysrgb&w=800,https://images.pexels.com/photos/236915/pexels-photo-236915.jpeg?auto=compress&cs=tinysrgb&w=800,https://images.pexels.com/photos/125779/pexels-photo-125779.jpeg?auto=compress&cs=tinysrgb&w=800,https://images.pexels.com/photos/190819/pexels-photo-190819.jpeg?auto=compress&cs=tinysrgb&w=800	classic quartz watch Men's business Sport waterproof student retro clock	accessories	138	17	WOKAI high quality men's fashion casual luminous belt classic quartz watch Men's business Sport waterproof student retro clock WOKAI high quality men's fashion casual luminous belt classic quartz watch Men's business Sport waterproof student retro clock WOKAI high quality men's fashion casual luminous belt classic quartz watch Men's business Sport waterproof student retro clock WOKAI high quality men's fashion casual luminous belt classic quartz watch Men's business Sport waterproof student retro clock WOKAI high quality men's fashion casual luminous belt classic quartz watch Men's business Sport waterproof student retro clock	2023-03-03
28	b22c3d99-d7e2-41f5-baf3-c2859cc17cae	https://images.pexels.com/photos/17834/pexels-photo.jpg?auto=compress&cs=tinysrgb&w=800,https://images.pexels.com/photos/1670723/pexels-photo-1670723.jpeg?auto=compress&cs=tinysrgb&w=800,https://images.pexels.com/photos/1302307/pexels-photo-1302307.jpeg?auto=compress&cs=tinysrgb&w=800,https://images.pexels.com/photos/1395306/pexels-photo-1395306.jpeg?auto=compress&cs=tinysrgb&w=800	Aquamarine Ruby High Carbon Diamond Heart Fine Jewelry Wholesale	jewelries	2350	20	OEVAS Solid 925 Sterling Silver Wedding Rings Sparkling Topaz Aquamarine Ruby High Carbon Diamond Heart Fine Jewelry Wholesale OEVAS Solid 925 Sterling Silver Wedding Rings Sparkling Topaz Aquamarine Ruby High Carbon Diamond Heart Fine Jewelry Wholesale OEVAS Solid 925 Sterling Silver Wedding Rings Sparkling Topaz Aquamarine Ruby High Carbon Diamond Heart Fine Jewelry Wholesale OEVAS Solid 925 Sterling Silver Wedding Rings Sparkling Topaz Aquamarine Ruby High Carbon Diamond Heart Fine Jewelry Wholesale OEVAS Solid 925 Sterling Silver Wedding Rings Sparkling Topaz Aquamarine Ruby High Carbon Diamond Heart Fine Jewelry Wholesale	2023-03-03
27	509dd317-6d23-4086-be28-71170e2539ba	https://images.pexels.com/photos/701877/pexels-photo-701877.jpeg?auto=compress&cs=tinysrgb&w=800,https://images.pexels.com/photos/947885/pexels-photo-947885.jpeg?auto=compress&cs=tinysrgb&w=800,https://images.pexels.com/photos/343720/pexels-photo-343720.jpeg?auto=compress&cs=tinysrgb&w=800,https://images.pexels.com/photos/249210/pexels-photo-249210.jpeg?auto=compress&cs=tinysrgb&w=800	Coating Drive Shades Gafas De Sol Masculino	accessories	369.85	20	UV400 HD Polarized Men Women Sunglasses Classic Fashion Retro Brand Sun Glasses Coating Drive Shades Gafas De Sol Masculino UV400 HD Polarized Men Women Sunglasses Classic Fashion Retro Brand Sun Glasses Coating Drive Shades Gafas De Sol Masculino UV400 HD Polarized Men Women Sunglasses Classic Fashion Retro Brand Sun Glasses Coating Drive Shades Gafas De Sol Masculino UV400 HD Polarized Men Women Sunglasses Classic Fashion Retro Brand Sun Glasses Coating Drive Shades Gafas De Sol Masculino UV400 HD Polarized Men Women Sunglasses Classic Fashion Retro Brand Sun Glasses Coating Drive Shades Gafas De Sol Masculino	2023-03-03
26	5702d545-e895-4876-8995-a312ba61843c	https://images.pexels.com/photos/2759779/pexels-photo-2759779.jpeg?auto=compress&cs=tinysrgb&w=800,https://images.pexels.com/photos/1670766/pexels-photo-1670766.jpeg?auto=compress&cs=tinysrgb&w=800,https://images.pexels.com/photos/1750045/pexels-photo-1750045.jpeg?auto=compress&cs=tinysrgb&w=800,https://images.pexels.com/photos/1456706/pexels-photo-1456706.jpeg?auto=compress&cs=tinysrgb&w=800	White Zapatillas Mujer Super Light Women Casual Shoes Sneakers	shoes	780	20	Women Shoes Breathable Vulcanized Shoes White Zapatillas Mujer Super Light Women Casual Shoes Sneakers Women 2021 Women Flat Women Shoes Breathable Vulcanized Shoes White Zapatillas Mujer Super Light Women Casual Shoes Sneakers Women 2021 Women Flat Women Shoes Breathable Vulcanized Shoes White Zapatillas Mujer Super Light Women Casual Shoes Sneakers Women 2021 Women Flat Women Shoes Breathable Vulcanized Shoes White Zapatillas Mujer Super Light Women Casual Shoes Sneakers Women 2021 Women Flat Women Shoes Breathable Vulcanized Shoes White Zapatillas Mujer Super Light Women Casual Shoes Sneakers Women 2021 Women Flat	2023-03-03
30	200d4cfc-5125-46e2-8b8b-4f2e658c3beb	https://images.pexels.com/photos/236915/pexels-photo-236915.jpeg?auto=compress&cs=tinysrgb&w=800,https://images.pexels.com/photos/125779/pexels-photo-125779.jpeg?auto=compress&cs=tinysrgb&w=800,https://images.pexels.com/photos/190819/pexels-photo-190819.jpeg?auto=compress&cs=tinysrgb&w=800,https://images.pexels.com/photos/47856/rolex-wrist-watch-clock-gmt-47856.jpeg?auto=compress&cs=tinysrgb&w=800	Ladies Leather Band Quartz Wristwatch Female Clock Zegarek Damski	accessories	630	20	Women Diamond Watch Starry Square Dial Bracelet Watches Set Ladies Leather Band Quartz Wristwatch Female Clock Zegarek Damski Women Diamond Watch Starry Square Dial Bracelet Watches Set Ladies Leather Band Quartz Wristwatch Female Clock Zegarek Damski Women Diamond Watch Starry Square Dial Bracelet Watches Set Ladies Leather Band Quartz Wristwatch Female Clock Zegarek Damski Women Diamond Watch Starry Square Dial Bracelet Watches Set Ladies Leather Band Quartz Wristwatch Female Clock Zegarek Damski Women Diamond Watch Starry Square Dial Bracelet Watches Set Ladies Leather Band Quartz Wristwatch Female Clock Zegarek Damski	2023-03-03
31	594d307e-8620-48eb-917b-65a1791b51a7	https://images.pexels.com/photos/1280064/pexels-photo-1280064.jpeg?auto=compress&cs=tinysrgb&w=800,https://images.pexels.com/photos/2529148/pexels-photo-2529148.jpeg?auto=compress&cs=tinysrgb&w=800,https://images.pexels.com/photos/1598505/pexels-photo-1598505.jpeg?auto=compress&cs=tinysrgb&w=800,https://images.pexels.com/photos/1478442/pexels-photo-1478442.jpeg?auto=compress&cs=tinysrgb&w=800	fashion Blade loafers running Shoe for men	shoes	3095.85	20	men shoes Sneakers Male tenis Luxury designer shoes Mens casual Shoes platform Shoes fashion Blade loafers running Shoe for men men shoes Sneakers Male tenis Luxury designer shoes Mens casual Shoes platform Shoes fashion Blade loafers running Shoe for men men shoes Sneakers Male tenis Luxury designer shoes Mens casual Shoes platform Shoes fashion Blade loafers running Shoe for men men shoes Sneakers Male tenis Luxury designer shoes Mens casual Shoes platform Shoes fashion Blade loafers running Shoe for men men shoes Sneakers Male tenis Luxury designer shoes Mens casual Shoes platform Shoes fashion Blade loafers running Shoe for men	2023-03-03
38	2784f83d-975e-4c77-b940-12c20c62821f	https://images.pexels.com/photos/47856/rolex-wrist-watch-clock-gmt-47856.jpeg?auto=compress&cs=tinysrgb&w=800,https://images.pexels.com/photos/2113994/pexels-photo-2113994.jpeg?auto=compress&cs=tinysrgb&w=800,https://images.pexels.com/photos/236915/pexels-photo-236915.jpeg?auto=compress&cs=tinysrgb&w=800,https://images.pexels.com/photos/125779/pexels-photo-125779.jpeg?auto=compress&cs=tinysrgb&w=800	Simple Ladies Round Dial Quartz Wristwatches Dress Clock Reloj Mujer	accessories	1049	20	New Watch Women Fashion Casual Leather Belt Watches Simple Ladies Round Dial Quartz Wristwatches Dress Clock Reloj Mujer New Watch Women Fashion Casual Leather Belt Watches Simple Ladies Round Dial Quartz Wristwatches Dress Clock Reloj Mujer New Watch Women Fashion Casual Leather Belt Watches Simple Ladies Round Dial Quartz Wristwatches Dress Clock Reloj Mujer New Watch Women Fashion Casual Leather Belt Watches Simple Ladies Round Dial Quartz Wristwatches Dress Clock Reloj Mujer New Watch Women Fashion Casual Leather Belt Watches Simple Ladies Round Dial Quartz Wristwatches Dress Clock Reloj Mujer	2023-03-03
9	c0e66b6d-228e-4646-91d2-7b34add83cbb	https://images.pexels.com/photos/157842/bezel-hairstyle-man-mode-157842.jpeg?auto=compress&cs=tinysrgb&w=800,https://images.pexels.com/photos/1043471/pexels-photo-1043471.jpeg?auto=compress&cs=tinysrgb&w=800,https://images.pexels.com/photos/6310924/pexels-photo-6310924.jpeg?auto=compress&cs=tinysrgb&w=800,https://images.pexels.com/photos/12821059/pexels-photo-12821059.jpeg?auto=compress&cs=tinysrgb&w=600	Spring Print Sleeve Streetwear Pullovers High Quality Male Clothes	clothing	127	20	Fashion Men Sweatshirts New Japanese Casual Hoodie Sweatshirt Spring Print Sleeve Streetwear Pullovers High Quality Male Clothes Fashion Men Sweatshirts New Japanese Casual Hoodie Sweatshirt Spring Print Sleeve Streetwear Pullovers High Quality Male Clothes Fashion Men Sweatshirts New Japanese Casual Hoodie Sweatshirt Spring Print Sleeve Streetwear Pullovers High Quality Male Clothes Fashion Men Sweatshirts New Japanese Casual Hoodie Sweatshirt Spring Print Sleeve Streetwear Pullovers High Quality Male Clothes Fashion Men Sweatshirts New Japanese Casual Hoodie Sweatshirt Spring Print Sleeve Streetwear Pullovers High Quality Male Clothes	2023-03-03
15	419934f5-0d9a-4b33-b3cc-c1d8c753185a	https://images.pexels.com/photos/1642228/pexels-photo-1642228.jpeg?auto=compress&cs=tinysrgb&w=600,https://images.pexels.com/photos/1024036/pexels-photo-1024036.jpeg?auto=compress&cs=tinysrgb&w=600,https://images.pexels.com/photos/9769853/pexels-photo-9769853.jpeg?auto=compress&cs=tinysrgb&w=600,https://images.pexels.com/photos/1475418/pexels-photo-1475418.jpeg?auto=compress&cs=tinysrgb&w=600	Summer Short Halter Red Dresses For Women Tight Club Mini Dress Clubwear	clothing	599	20	Fairyshely Sexy Ruffle V Deep Evening Party Dress 2022 Summer Short Halter Red Dresses For Women Tight Club Mini Dress Clubwear Fairyshely Sexy Ruffle V Deep Evening Party Dress 2022 Summer Short Halter Red Dresses For Women Tight Club Mini Dress Clubwear Fairyshely Sexy Ruffle V Deep Evening Party Dress 2022 Summer Short Halter Red Dresses For Women Tight Club Mini Dress Clubwear Fairyshely Sexy Ruffle V Deep Evening Party Dress 2022 Summer Short Halter Red Dresses For Women Tight Club Mini Dress Clubwear Fairyshely Sexy Ruffle V Deep Evening Party Dress 2022 Summer Short Halter Red Dresses For Women Tight Club Mini Dress Clubwear	2023-03-03
17	1e5b99ae-99d4-4b73-8390-91f644a90bde	https://images.pexels.com/photos/1043471/pexels-photo-1043471.jpeg?auto=compress&cs=tinysrgb&w=800,https://images.pexels.com/photos/6310924/pexels-photo-6310924.jpeg?auto=compress&cs=tinysrgb&w=800,https://images.pexels.com/photos/12821059/pexels-photo-12821059.jpeg?auto=compress&cs=tinysrgb&w=600,https://images.pexels.com/photos/2072453/pexels-photo-2072453.jpeg?auto=compress&cs=tinysrgb&w=800	Male Casual Loose Outerwear 2022 New Spring Fashion Slim Fit Coat	clothing	145	20	Men Denim Jacket Streetwear Hip Hop Men's Hooded Jean Jackets Male Casual Loose Outerwear 2022 New Spring Fashion Slim Fit Coat Men Denim Jacket Streetwear Hip Hop Men's Hooded Jean Jackets Male Casual Loose Outerwear 2022 New Spring Fashion Slim Fit Coat Men Denim Jacket Streetwear Hip Hop Men's Hooded Jean Jackets Male Casual Loose Outerwear 2022 New Spring Fashion Slim Fit Coat Men Denim Jacket Streetwear Hip Hop Men's Hooded Jean Jackets Male Casual Loose Outerwear 2022 New Spring Fashion Slim Fit Coat Men Denim Jacket Streetwear Hip Hop Men's Hooded Jean Jackets Male Casual Loose Outerwear 2022 New Spring Fashion Slim Fit Coat	2023-03-03
