24	fba10932-23a3-461a-8b76-290f4f94e284	https://images.pexels.com/photos/1024036/pexels-photo-1024036.jpeg?auto=compress&cs=tinysrgb&w=600,https://images.pexels.com/photos/9769853/pexels-photo-9769853.jpeg?auto=compress&cs=tinysrgb&w=600,https://images.pexels.com/photos/1475418/pexels-photo-1475418.jpeg?auto=compress&cs=tinysrgb&w=600,https://images.pexels.com/photos/1040424/pexels-photo-1040424.jpeg?auto=compress&cs=tinysrgb&w=600	FQLWL Summer Sexy Bodycon Mini Dress 2023	clothing	980	20	FQLWL Summer Sexy Bodycon Mini Dress 2023 Solid Club Outfit Dress For Women Pink Green Black Party Wrap Ladies Dress Female FQLWL Summer Sexy Bodycon Mini Dress 2023 Solid Club Outfit Dress For Women Pink Green Black Party Wrap Ladies Dress Female FQLWL Summer Sexy Bodycon Mini Dress 2023 Solid Club Outfit Dress For Women Pink Green Black Party Wrap Ladies Dress Female FQLWL Summer Sexy Bodycon Mini Dress 2023 Solid Club Outfit Dress For Women Pink Green Black Party Wrap Ladies Dress Female FQLWL Summer Sexy Bodycon Mini Dress 2023 Solid Club Outfit Dress For Women Pink Green Black Party Wrap Ladies Dress Female	2023-03-03
8	75dce138-858a-4ed8-bba5-3d14d221f197	https://images.pexels.com/photos/1040424/pexels-photo-1040424.jpeg?auto=compress&cs=tinysrgb&w=600,https://images.pexels.com/photos/1642228/pexels-photo-1642228.jpeg?auto=compress&cs=tinysrgb&w=600,https://images.pexels.com/photos/1024036/pexels-photo-1024036.jpeg?auto=compress&cs=tinysrgb&w=600,https://images.pexels.com/photos/9769853/pexels-photo-9769853.jpeg?auto=compress&cs=tinysrgb&w=600	Sexy Black Faux Leather Goth High Waisted Womens Shorts	clothing	89.99	20	Sexy Black PU Fashion Casual Summer Shorts Women Clothing Faux Leather Goth High Waisted Womens Shorts Y2k Hot Woman Short Pants Sexy Black PU Fashion Casual Summer Shorts Women Clothing Faux Leather Goth High Waisted Womens Shorts Y2k Hot Woman Short Pants Sexy Black PU Fashion Casual Summer Shorts Women Clothing Faux Leather Goth High Waisted Womens Shorts Y2k Hot Woman Short Pants Sexy Black PU Fashion Casual Summer Shorts Women Clothing Faux Leather Goth High Waisted Womens Shorts Y2k Hot Woman Short Pants Sexy Black PU Fashion Casual Summer Shorts Women Clothing Faux Leather Goth High Waisted Womens Shorts Y2k Hot Woman Short Pants	2023-03-03
25	be8a55de-b15d-4b90-8e88-4a214480fb83	https://images.pexels.com/photos/6310924/pexels-photo-6310924.jpeg?auto=compress&cs=tinysrgb&w=800,https://images.pexels.com/photos/12821059/pexels-photo-12821059.jpeg?auto=compress&cs=tinysrgb&w=600,https://images.pexels.com/photos/2072453/pexels-photo-2072453.jpeg?auto=compress&cs=tinysrgb&w=800,https://images.pexels.com/photos/157842/bezel-hairstyle-man-mode-157842.jpeg?auto=compress&cs=tinysrgb&w=800	Techwear Hip Hop Harajuku Patchwork Japanese Streetwear	clothing	235	20	Autumn Men's Hoodie Sweatshirt Casual Black Hoodies Tops Techwear Hip Hop Harajuku Patchwork Japanese Streetwear Men 3XL Autumn Men's Hoodie Sweatshirt Casual Black Hoodies Tops Techwear Hip Hop Harajuku Patchwork Japanese Streetwear Men 3XL Autumn Men's Hoodie Sweatshirt Casual Black Hoodies Tops Techwear Hip Hop Harajuku Patchwork Japanese Streetwear Men 3XL Autumn Men's Hoodie Sweatshirt Casual Black Hoodies Tops Techwear Hip Hop Harajuku Patchwork Japanese Streetwear Men 3XL Autumn Men's Hoodie Sweatshirt Casual Black Hoodies Tops Techwear Hip Hop Harajuku Patchwork Japanese Streetwear Men 3XL	2023-03-03
32	5466f635-3b27-4868-8fd0-223193bdd1f7	https://images.pexels.com/photos/9769853/pexels-photo-9769853.jpeg?auto=compress&cs=tinysrgb&w=600,https://images.pexels.com/photos/1475418/pexels-photo-1475418.jpeg?auto=compress&cs=tinysrgb&w=600,https://images.pexels.com/photos/1040424/pexels-photo-1040424.jpeg?auto=compress&cs=tinysrgb&w=600,https://images.pexels.com/photos/1642228/pexels-photo-1642228.jpeg?auto=compress&cs=tinysrgb&w=600	Jeans Pants Gym Tights For Yoga Clothing Fitness Grey Jeggings	clothing	208	20	Melody Women's Push-Up Leggins Sports Pants for Women Jeans Pants Gym Tights For Yoga Clothing Fitness Grey Jeggings Melody Women's Push-Up Leggins Sports Pants for Women Jeans Pants Gym Tights For Yoga Clothing Fitness Grey Jeggings Melody Women's Push-Up Leggins Sports Pants for Women Jeans Pants Gym Tights For Yoga Clothing Fitness Grey Jeggings Melody Women's Push-Up Leggins Sports Pants for Women Jeans Pants Gym Tights For Yoga Clothing Fitness Grey Jeggings Melody Women's Push-Up Leggins Sports Pants for Women Jeans Pants Gym Tights For Yoga Clothing Fitness Grey Jeggings	2023-03-03
33	620dec8a-ee2e-4231-b5d5-a352f0b68acc	https://images.pexels.com/photos/157842/bezel-hairstyle-man-mode-157842.jpeg?auto=compress&cs=tinysrgb&w=800,https://images.pexels.com/photos/1043471/pexels-photo-1043471.jpeg?auto=compress&cs=tinysrgb&w=800,https://images.pexels.com/photos/6310924/pexels-photo-6310924.jpeg?auto=compress&cs=tinysrgb&w=800,https://images.pexels.com/photos/12821059/pexels-photo-12821059.jpeg?auto=compress&cs=tinysrgb&w=600	vest fashion sleeveless warm down cotton waistcoat	clothing	620	20	New autumn winter letter waistcoat men casual stand collar down cotton vest fashion sleeveless warm down cotton waistcoat New autumn winter letter waistcoat men casual stand collar down cotton vest fashion sleeveless warm down cotton waistcoat New autumn winter letter waistcoat men casual stand collar down cotton vest fashion sleeveless warm down cotton waistcoat New autumn winter letter waistcoat men casual stand collar down cotton vest fashion sleeveless warm down cotton waistcoat New autumn winter letter waistcoat men casual stand collar down cotton vest fashion sleeveless warm down cotton waistcoat	2023-03-03
12	5ff03afd-ea6c-4a05-a829-a9a29e8e29bc	https://images.pexels.com/photos/1302307/pexels-photo-1302307.jpeg?auto=compress&cs=tinysrgb&w=800,https://images.pexels.com/photos/10976653/pexels-photo-10976653.jpeg?auto=compress&cs=tinysrgb&w=800,https://images.pexels.com/photos/17834/pexels-photo.jpg?auto=compress&cs=tinysrgb&w=800,https://images.pexels.com/photos/1395306/pexels-photo-1395306.jpeg?auto=compress&cs=tinysrgb&w=800	Classic Party Women's Jewelry Accessories Gift Pendientes Mujer	jewelries	35	20	Vintage Fashion Cross Zircon Ear Clip Pendant Earrings for Women Classic Party Women's Jewelry Accessories Gift Pendientes Mujer Vintage Fashion Cross Zircon Ear Clip Pendant Earrings for Women Classic Party Women's Jewelry Accessories Gift Pendientes Mujer Vintage Fashion Cross Zircon Ear Clip Pendant Earrings for Women Classic Party Women's Jewelry Accessories Gift Pendientes Mujer Vintage Fashion Cross Zircon Ear Clip Pendant Earrings for Women Classic Party Women's Jewelry Accessories Gift Pendientes Mujer Vintage Fashion Cross Zircon Ear Clip Pendant Earrings for Women Classic Party Women's Jewelry Accessories Gift Pendientes Mujer\n	2023-03-03
21	ecdbefcd-960b-48f2-adb6-131ce2958910	https://images.pexels.com/photos/13325931/pexels-photo-13325931.jpeg?auto=compress&cs=tinysrgb&w=800,https://images.pexels.com/photos/7134458/pexels-photo-7134458.jpeg?auto=compress&cs=tinysrgb&w=800,https://images.pexels.com/photos/9332184/pexels-photo-9332184.jpeg?auto=compress&cs=tinysrgb&w=800,https://images.pexels.com/photos/7407597/pexels-photo-7407597.png?auto=compress&cs=tinysrgb&w=800	Diamond Rings For Women Sparkling Wedding Fine Jewelry Wholesale Gift	jewelries	2163	20	OEVAS 100% 925 Sterling Silver 10*10mm Emerald High Carbon Diamond Rings For Women Sparkling Wedding Fine Jewelry Wholesale Gift OEVAS 100% 925 Sterling Silver 10*10mm Emerald High Carbon Diamond Rings For Women Sparkling Wedding Fine Jewelry Wholesale Gift OEVAS 100% 925 Sterling Silver 10*10mm Emerald High Carbon Diamond Rings For Women Sparkling Wedding Fine Jewelry Wholesale Gift OEVAS 100% 925 Sterling Silver 10*10mm Emerald High Carbon Diamond Rings For Women Sparkling Wedding Fine Jewelry Wholesale Gift OEVAS 100% 925 Sterling Silver 10*10mm Emerald High Carbon Diamond Rings For Women Sparkling Wedding Fine Jewelry Wholesale Gift	2023-03-03
29	da47ab5c-ae2b-4db4-95a8-05de74e66e2e	https://images.pexels.com/photos/7134458/pexels-photo-7134458.jpeg?auto=compress&cs=tinysrgb&w=800,https://images.pexels.com/photos/9332184/pexels-photo-9332184.jpeg?auto=compress&cs=tinysrgb&w=800,https://images.pexels.com/photos/7407597/pexels-photo-7407597.png?auto=compress&cs=tinysrgb&w=800,https://images.pexels.com/photos/11203732/pexels-photo-11203732.jpeg?auto=compress&cs=tinysrgb&w=800	Sweet Elegant Ballerina Girl Crystal Zircon Pendant Necklaces For Women	jewelries	450.25	20	Sweet Elegant Ballerina Girl Crystal Zircon Pendant Necklaces For Women Korean Fashion Ladies Sexy Stainless Steel Jewelry Gift Sweet Elegant Ballerina Girl Crystal Zircon Pendant Necklaces For Women Korean Fashion Ladies Sexy Stainless Steel Jewelry Gift Sweet Elegant Ballerina Girl Crystal Zircon Pendant Necklaces For Women Korean Fashion Ladies Sexy Stainless Steel Jewelry Gift Sweet Elegant Ballerina Girl Crystal Zircon Pendant Necklaces For Women Korean Fashion Ladies Sexy Stainless Steel Jewelry Gift Sweet Elegant Ballerina Girl Crystal Zircon Pendant Necklaces For Women Korean Fashion Ladies Sexy Stainless Steel Jewelry Gift	2023-03-03
36	d37185db-a6a6-4d12-9fe8-31b2456f99c9	https://images.pexels.com/photos/1395306/pexels-photo-1395306.jpeg?auto=compress&cs=tinysrgb&w=800,https://images.pexels.com/photos/10976653/pexels-photo-10976653.jpeg?auto=compress&cs=tinysrgb&w=800,https://images.pexels.com/photos/17834/pexels-photo.jpg?auto=compress&cs=tinysrgb&w=800,https://images.pexels.com/photos/1670723/pexels-photo-1670723.jpeg?auto=compress&cs=tinysrgb&w=800	Boho Thick Gold Color Charm Bracelets Bangles 2022	jewelries	390	20	Boho Thick Gold Color Charm Bracelets Bangles 2022 New Fashion Jewelry 4pcs Punk Curb Cuban Chain Bracelets Set for Women Gifts Boho Thick Gold Color Charm Bracelets Bangles 2022 New Fashion Jewelry 4pcs Punk Curb Cuban Chain Bracelets Set for Women Gifts Boho Thick Gold Color Charm Bracelets Bangles 2022 New Fashion Jewelry 4pcs Punk Curb Cuban Chain Bracelets Set for Women Gifts Boho Thick Gold Color Charm Bracelets Bangles 2022 New Fashion Jewelry 4pcs Punk Curb Cuban Chain Bracelets Set for Women Gifts Boho Thick Gold Color Charm Bracelets Bangles 2022 New Fashion Jewelry 4pcs Punk Curb Cuban Chain Bracelets Set for Women Gifts	2023-03-03
37	f6106357-46de-4b39-825a-28507becf17a	https://images.pexels.com/photos/11203732/pexels-photo-11203732.jpeg?auto=compress&cs=tinysrgb&w=800,https://images.pexels.com/photos/13325931/pexels-photo-13325931.jpeg?auto=compress&cs=tinysrgb&w=800,https://images.pexels.com/photos/7134458/pexels-photo-7134458.jpeg?auto=compress&cs=tinysrgb&w=800,https://images.pexels.com/photos/9332184/pexels-photo-9332184.jpeg?auto=compress&cs=tinysrgb&w=800	Round Cut Diamond Solitaire Pendant Necklace for Women	jewelries	864	20	100% Moissanite Necklace 925 Sterling Silver 3CT Round Cut Diamond Solitaire Pendant Necklace for Women Men Promise Gift Jewelry 100% Moissanite Necklace 925 Sterling Silver 3CT Round Cut Diamond Solitaire Pendant Necklace for Women Men Promise Gift Jewelry 100% Moissanite Necklace 925 Sterling Silver 3CT Round Cut Diamond Solitaire Pendant Necklace for Women Men Promise Gift Jewelry 100% Moissanite Necklace 925 Sterling Silver 3CT Round Cut Diamond Solitaire Pendant Necklace for Women Men Promise Gift Jewelry 100% Moissanite Necklace 925 Sterling Silver 3CT Round Cut Diamond Solitaire Pendant Necklace for Women Men Promise Gift Jewelry	2023-03-03
13	9840da31-bd88-486a-85c3-6372e2e896b3	https://images.pexels.com/photos/190819/pexels-photo-190819.jpeg?auto=compress&cs=tinysrgb&w=800,https://images.pexels.com/photos/2113994/pexels-photo-2113994.jpeg?auto=compress&cs=tinysrgb&w=800,https://images.pexels.com/photos/236915/pexels-photo-236915.jpeg?auto=compress&cs=tinysrgb&w=800,https://images.pexels.com/photos/47856/rolex-wrist-watch-clock-gmt-47856.jpeg?auto=compress&cs=tinysrgb&w=800	Zodvboz 2023 New Smart Watch Round Smartwatch Bluetooth Calls	accessories	1035	20	Zodvboz 2023 New Smart Watch Round Smartwatch Bluetooth Calls Watches Men Women Fitness Bracelet Custom Watch Face +Gift Box Zodvboz 2023 New Smart Watch Round Smartwatch Bluetooth Calls Watches Men Women Fitness Bracelet Custom Watch Face +Gift Box Zodvboz 2023 New Smart Watch Round Smartwatch Bluetooth Calls Watches Men Women Fitness Bracelet Custom Watch Face +Gift Box Zodvboz 2023 New Smart Watch Round Smartwatch Bluetooth Calls Watches Men Women Fitness Bracelet Custom Watch Face +Gift Box Zodvboz 2023 New Smart Watch Round Smartwatch Bluetooth Calls Watches Men Women Fitness Bracelet Custom Watch Face +Gift Box	2023-03-03
18	cc18ee7c-0c5b-477f-a8d1-05010e56d77a	https://images.pexels.com/photos/1598508/pexels-photo-1598508.jpeg?auto=compress&cs=tinysrgb&w=800,https://images.pexels.com/photos/2759779/pexels-photo-2759779.jpeg?auto=compress&cs=tinysrgb&w=800,https://images.pexels.com/photos/1670766/pexels-photo-1670766.jpeg?auto=compress&cs=tinysrgb&w=800,https://images.pexels.com/photos/1750045/pexels-photo-1750045.jpeg?auto=compress&cs=tinysrgb&w=800	Summer Sandals With Heels Gladiator Sandalias Mujer Elegant Wedges Shoes	shoes	914	20	Women Sandals Bohemian Style Summer Shoes For Women Summer Sandals With Heels Gladiator Sandalias Mujer Elegant Wedges Shoes Women Sandals Bohemian Style Summer Shoes For Women Summer Sandals With Heels Gladiator Sandalias Mujer Elegant Wedges Shoes Women Sandals Bohemian Style Summer Shoes For Women Summer Sandals With Heels Gladiator Sandalias Mujer Elegant Wedges Shoes Women Sandals Bohemian Style Summer Shoes For Women Summer Sandals With Heels Gladiator Sandalias Mujer Elegant Wedges Shoes Women Sandals Bohemian Style Summer Shoes For Women Summer Sandals With Heels Gladiator Sandalias Mujer Elegant Wedges Shoes	2023-03-03
34	0de80393-a511-4f39-b370-d1f450831c62	https://images.pexels.com/photos/1456706/pexels-photo-1456706.jpeg?auto=compress&cs=tinysrgb&w=800,https://images.pexels.com/photos/1598508/pexels-photo-1598508.jpeg?auto=compress&cs=tinysrgb&w=800,https://images.pexels.com/photos/2759779/pexels-photo-2759779.jpeg?auto=compress&cs=tinysrgb&w=800,https://images.pexels.com/photos/1670766/pexels-photo-1670766.jpeg?auto=compress&cs=tinysrgb&w=800	Thick Heel Elegant Retro Open Toe Embroidered Shoes Women	shoes	999.99	20	Ethnic Style Embroidered Mid-heel Sandals Women 2023 Summer All-match Thick Heel Elegant Retro Open Toe Embroidered Shoes Women Ethnic Style Embroidered Mid-heel Sandals Women 2023 Summer All-match Thick Heel Elegant Retro Open Toe Embroidered Shoes Women Ethnic Style Embroidered Mid-heel Sandals Women 2023 Summer All-match Thick Heel Elegant Retro Open Toe Embroidered Shoes Women Ethnic Style Embroidered Mid-heel Sandals Women 2023 Summer All-match Thick Heel Elegant Retro Open Toe Embroidered Shoes Women Ethnic Style Embroidered Mid-heel Sandals Women 2023 Summer All-match Thick Heel Elegant Retro Open Toe Embroidered Shoes Women	2023-03-03
2	f8f755ca-ddb4-41ac-8a39-893ff3551009	https://images.pexels.com/photos/1670766/pexels-photo-1670766.jpeg?auto=compress&cs=tinysrgb&w=800,https://images.pexels.com/photos/1750045/pexels-photo-1750045.jpeg?auto=compress&cs=tinysrgb&w=800,https://images.pexels.com/photos/1598508/pexels-photo-1598508.jpeg?auto=compress&cs=tinysrgb&w=800,https://images.pexels.com/photos/2759779/pexels-photo-2759779.jpeg?auto=compress&cs=tinysrgb&w=800	Lightweight Low Top Sports Anti Slip Running Shoes	shoes	65	20	Women Knitted Octopus Sneakers Lightweight Low Top Sports Anti Slip Running Shoes Women Knitted Octopus Sneakers Lightweight Low Top Sports Anti Slip Running Shoes Women Knitted Octopus Sneakers Lightweight Low Top Sports Anti Slip Running Shoes Women Knitted Octopus Sneakers Lightweight Low Top Sports Anti Slip Running Shoes Women Knitted Octopus Sneakers Lightweight Low Top Sports Anti Slip Running Shoes Women Knitted Octopus Sneakers Lightweight Low Top Sports Anti Slip Running Shoes\n	2023-03-03
40	dec61c41-9fa7-4302-b625-ec28d91db42f	https://images.pexels.com/photos/1642228/pexels-photo-1642228.jpeg?auto=compress&cs=tinysrgb&w=600,https://images.pexels.com/photos/1024036/pexels-photo-1024036.jpeg?auto=compress&cs=tinysrgb&w=600,https://images.pexels.com/photos/9769853/pexels-photo-9769853.jpeg?auto=compress&cs=tinysrgb&w=600,https://images.pexels.com/photos/1475418/pexels-photo-1475418.jpeg?auto=compress&cs=tinysrgb&w=600	Short Sleeve Female Top Tee T-shirt Summer Cartoon Graphic T Shirt	clothing	184	20	Clothes Women Dream Web Trend Cute 90s Clothing Fashion Short Sleeve Female Top Tee T-shirt Summer Cartoon Graphic T Shirt Clothes Women Dream Web Trend Cute 90s Clothing Fashion Short Sleeve Female Top Tee T-shirt Summer Cartoon Graphic T Shirt Clothes Women Dream Web Trend Cute 90s Clothing Fashion Short Sleeve Female Top Tee T-shirt Summer Cartoon Graphic T Shirt Clothes Women Dream Web Trend Cute 90s Clothing Fashion Short Sleeve Female Top Tee T-shirt Summer Cartoon Graphic T Shirt Clothes Women Dream Web Trend Cute 90s Clothing Fashion Short Sleeve Female Top Tee T-shirt Summer Cartoon Graphic T Shirt	2023-03-03
39	35423ca8-de0e-4619-9eb5-c26c32ec7e81	https://images.pexels.com/photos/1478442/pexels-photo-1478442.jpeg?auto=compress&cs=tinysrgb&w=800,https://images.pexels.com/photos/1032110/pexels-photo-1032110.jpeg?auto=compress&cs=tinysrgb&w=800,https://images.pexels.com/photos/1280064/pexels-photo-1280064.jpeg?auto=compress&cs=tinysrgb&w=800,https://images.pexels.com/photos/2529148/pexels-photo-2529148.jpeg?auto=compress&cs=tinysrgb&w=800	fashion loafers running Shoes for men	shoes	480	20	Men Shoes Sneakers Male casual Mens Shoes tenis Luxury shoes Trainer Race Breathable Shoes fashion loafers running Shoes for men Men Shoes Sneakers Male casual Mens Shoes tenis Luxury shoes Trainer Race Breathable Shoes fashion loafers running Shoes for men Men Shoes Sneakers Male casual Mens Shoes tenis Luxury shoes Trainer Race Breathable Shoes fashion loafers running Shoes for men Men Shoes Sneakers Male casual Mens Shoes tenis Luxury shoes Trainer Race Breathable Shoes fashion loafers running Shoes for men Men Shoes Sneakers Male casual Mens Shoes tenis Luxury shoes Trainer Race Breathable Shoes fashion loafers running Shoes for men	2023-03-03
35	da1e5283-5f41-4477-8296-9228527041e2	https://images.pexels.com/photos/249210/pexels-photo-249210.jpeg?auto=compress&cs=tinysrgb&w=800,https://images.pexels.com/photos/46710/pexels-photo-46710.jpeg?auto=compress&cs=tinysrgb&w=800,https://images.pexels.com/photos/701877/pexels-photo-701877.jpeg?auto=compress&cs=tinysrgb&w=800,https://images.pexels.com/photos/947885/pexels-photo-947885.jpeg?auto=compress&cs=tinysrgb&w=800	Classic Anti-Blue Light Reading Glasses for men and women	accessories	49.99	18	Classic Anti-Blue Light Reading Glasses Women Men Optical Eyeglasses Computer Presbyopia Glasses+1.0+1.5+2.0+2.5+3.0+3.5+4.0 Classic Anti-Blue Light Reading Glasses Women Men Optical Eyeglasses Computer Presbyopia Glasses+1.0+1.5+2.0+2.5+3.0+3.5+4.0 Classic Anti-Blue Light Reading Glasses Women Men Optical Eyeglasses Computer Presbyopia Glasses+1.0+1.5+2.0+2.5+3.0+3.5+4.0 Classic Anti-Blue Light Reading Glasses Women Men Optical Eyeglasses Computer Presbyopia Glasses+1.0+1.5+2.0+2.5+3.0+3.5+4.0 Classic Anti-Blue Light Reading Glasses Women Men Optical Eyeglasses Computer Presbyopia Glasses+1.0+1.5+2.0+2.5+3.0+3.5+4.0	2023-03-03
